{"schema_version": 2, "trial_id": 1, "commit": "896d7a6", "timestamp": "2026-06-07T22:17:19.251136+00:00", "task": "credit-g", "model_family": "random_forest", "hyperparameters": {"n_estimators": 300, "max_depth": null, "min_samples_leaf": 1, "min_samples_split": 2, "max_features": "sqrt", "class_weight": "balanced"}, "val_logloss": 0.479803, "val_acc": 0.75, "val_auc": 0.803452, "train_seconds": 0.3, "total_seconds": 0.4, "peak_mem_mb": 143.6, "n_params": 300, "status": "keep", "description": "", "source": "agent", "bo_episode_id": null, "bo_trial_index": null, "estimator_class": "RandomForestClassifier"}
{"schema_version": 2, "trial_id": 2, "commit": "23ba42a", "timestamp": "2026-06-07T22:18:07.189756+00:00", "task": "credit-g", "model_family": "xgboost", "hyperparameters": {"n_estimators": 500, "max_depth": 4, "learning_rate": 0.05, "subsample": 0.8, "colsample_bytree": 0.8, "reg_lambda": 1.5, "reg_alpha": 0.0}, "val_logloss": 0.571716, "val_acc": 0.765, "val_auc": 0.774643, "train_seconds": 0.2, "total_seconds": 0.3, "peak_mem_mb": 244.4, "n_params": 2000, "status": "keep", "description": "", "source": "agent", "bo_episode_id": null, "bo_trial_index": null, "estimator_class": "XGBClassifier"}
{"schema_version": 2, "trial_id": 3, "commit": "bb1e576", "timestamp": "2026-06-07T22:19:00.759171+00:00", "task": "credit-g", "model_family": "xgboost", "hyperparameters": {"n_estimators": 400, "max_depth": 4, "learning_rate": 0.05, "subsample": 0.8, "colsample_bytree": 0.8, "reg_lambda": 1.0, "reg_alpha": 0.0}, "val_logloss": 0.530241, "val_acc": 0.745, "val_auc": 0.777619, "train_seconds": 0.2, "total_seconds": 0.3, "peak_mem_mb": 243.7, "n_params": 1600, "status": "keep", "description": "", "source": "agent", "bo_episode_id": null, "bo_trial_index": null, "estimator_class": "XGBClassifier"}
{"schema_version": 2, "trial_id": 4, "commit": "a3200cb", "timestamp": "2026-06-07T22:19:50.309461+00:00", "task": "credit-g", "model_family": "random_forest", "hyperparameters": {"n_estimators": 500, "max_depth": null, "min_samples_leaf": 1, "min_samples_split": 2, "max_features": "sqrt", "class_weight": null}, "val_logloss": 0.470656, "val_acc": 0.78, "val_auc": 0.825476, "train_seconds": 0.4, "total_seconds": 0.6, "peak_mem_mb": 148.3, "n_params": 500, "status": "keep", "description": "", "source": "agent", "bo_episode_id": null, "bo_trial_index": null, "estimator_class": "RandomForestClassifier"}
{"schema_version": 2, "trial_id": 5, "commit": "22f1c5e", "timestamp": "2026-06-07T22:20:27.729424+00:00", "task": "credit-g", "model_family": "random_forest", "hyperparameters": {"n_estimators": 500, "max_depth": null, "min_samples_leaf": 1, "min_samples_split": 2, "max_features": "sqrt", "class_weight": null, "calibration_method": "sigmoid", "calibration_cv": 5}, "val_logloss": 0.471813, "val_acc": 0.775, "val_auc": 0.819524, "train_seconds": 2.3, "total_seconds": 2.9, "peak_mem_mb": 191.3, "n_params": 2500, "status": "keep", "description": "", "source": "agent", "bo_episode_id": null, "bo_trial_index": null, "estimator_class": "RandomForestClassifier"}
{"schema_version": 2, "trial_id": 6, "commit": "3d915fa", "timestamp": "2026-06-07T22:20:59.865520+00:00", "task": "credit-g", "model_family": "logistic_regression", "hyperparameters": {"c": 0.1, "max_iter": 2000, "solver": "lbfgs"}, "val_logloss": 0.510887, "val_acc": 0.745, "val_auc": 0.77369, "train_seconds": 0.0, "total_seconds": 0.1, "peak_mem_mb": 129.1, "n_params": 10, "status": "keep", "description": "", "source": "agent", "bo_episode_id": null, "bo_trial_index": null, "estimator_class": "LogisticRegression"}
{"schema_version": 2, "trial_id": 7, "commit": "a3200cb", "timestamp": "2026-06-07T22:21:55.151946+00:00", "task": "credit-g", "model_family": "random_forest", "hyperparameters": {"n_estimators": 308, "max_features": "sqrt", "min_samples_leaf": 1}, "val_logloss": 0.495432, "val_acc": 0.745, "val_auc": 0.790357, "train_seconds": 0.263, "total_seconds": 0.398, "peak_mem_mb": 145.1, "n_params": 0, "status": "bo_trial", "description": "bo episode bo-ep001 trial 1", "source": "bo", "bo_episode_id": "bo-ep001", "bo_trial_index": 1, "estimator_class": null}
{"schema_version": 2, "trial_id": 8, "commit": "a3200cb", "timestamp": "2026-06-07T22:21:56.112180+00:00", "task": "credit-g", "model_family": "random_forest", "hyperparameters": {"n_estimators": 165, "max_features": 0.3, "min_samples_leaf": 6}, "val_logloss": 1.221729, "val_acc": NaN, "val_auc": NaN, "train_seconds": NaN, "total_seconds": 0.9510324000002583, "peak_mem_mb": NaN, "n_params": 0, "status": "bo_trial", "description": "bo episode bo-ep001 trial 2", "source": "bo", "bo_episode_id": "bo-ep001", "bo_trial_index": 2, "estimator_class": null}
{"schema_version": 2, "trial_id": 9, "commit": "a3200cb", "timestamp": "2026-06-07T22:21:57.380545+00:00", "task": "credit-g", "model_family": "random_forest", "hyperparameters": {"n_estimators": 173, "max_features": "sqrt", "min_samples_leaf": 5}, "val_logloss": 0.49845, "val_acc": 0.78, "val_auc": 0.804048, "train_seconds": 0.161, "total_seconds": 0.288, "peak_mem_mb": 138.0, "n_params": 0, "status": "bo_trial", "description": "bo episode bo-ep001 trial 3", "source": "bo", "bo_episode_id": "bo-ep001", "bo_trial_index": 3, "estimator_class": null}
{"schema_version": 2, "trial_id": 10, "commit": "a3200cb", "timestamp": "2026-06-07T22:21:58.374299+00:00", "task": "credit-g", "model_family": "random_forest", "hyperparameters": {"n_estimators": 1281, "max_features": "sqrt", "min_samples_leaf": 1}, "val_logloss": 1.221729, "val_acc": NaN, "val_auc": NaN, "train_seconds": NaN, "total_seconds": 0.973491799995827, "peak_mem_mb": NaN, "n_params": 0, "status": "bo_trial", "description": "bo episode bo-ep001 trial 4", "source": "bo", "bo_episode_id": "bo-ep001", "bo_trial_index": 4, "estimator_class": null}
{"schema_version": 2, "trial_id": 11, "commit": "a3200cb", "timestamp": "2026-06-07T22:21:59.345780+00:00", "task": "credit-g", "model_family": "random_forest", "hyperparameters": {"n_estimators": 736, "max_features": 0.5, "min_samples_leaf": 2}, "val_logloss": 1.221729, "val_acc": NaN, "val_auc": NaN, "train_seconds": NaN, "total_seconds": 0.9717716000013752, "peak_mem_mb": NaN, "n_params": 0, "status": "bo_trial", "description": "bo episode bo-ep001 trial 5", "source": "bo", "bo_episode_id": "bo-ep001", "bo_trial_index": 5, "estimator_class": null}
{"schema_version": 2, "trial_id": 12, "commit": "a3200cb", "timestamp": "2026-06-07T22:22:00.848854+00:00", "task": "credit-g", "model_family": "random_forest", "hyperparameters": {"n_estimators": 403, "max_features": "log2", "min_samples_leaf": 4}, "val_logloss": 0.506289, "val_acc": 0.755, "val_auc": 0.797381, "train_seconds": 0.337, "total_seconds": 0.503, "peak_mem_mb": 140.9, "n_params": 0, "status": "bo_trial", "description": "bo episode bo-ep001 trial 6", "source": "bo", "bo_episode_id": "bo-ep001", "bo_trial_index": 6, "estimator_class": null}
{"schema_version": 2, "trial_id": 13, "commit": "a3200cb", "timestamp": "2026-06-07T22:22:02.318154+00:00", "task": "credit-g", "model_family": "random_forest", "hyperparameters": {"n_estimators": 371, "max_features": "sqrt", "min_samples_leaf": 8}, "val_logloss": 0.507908, "val_acc": 0.74, "val_auc": 0.799643, "train_seconds": 0.329, "total_seconds": 0.498, "peak_mem_mb": 138.7, "n_params": 0, "status": "bo_trial", "description": "bo episode bo-ep001 trial 7", "source": "bo", "bo_episode_id": "bo-ep001", "bo_trial_index": 7, "estimator_class": null}
{"schema_version": 2, "trial_id": 14, "commit": "a3200cb", "timestamp": "2026-06-07T22:22:03.295005+00:00", "task": "credit-g", "model_family": "random_forest", "hyperparameters": {"n_estimators": 126, "max_features": 0.3, "min_samples_leaf": 3}, "val_logloss": 1.221729, "val_acc": NaN, "val_auc": NaN, "train_seconds": NaN, "total_seconds": 0.9672485000046436, "peak_mem_mb": NaN, "n_params": 0, "status": "bo_trial", "description": "bo episode bo-ep001 trial 8", "source": "bo", "bo_episode_id": "bo-ep001", "bo_trial_index": 8, "estimator_class": null}
{"schema_version": 2, "trial_id": 15, "commit": "a3200cb", "timestamp": "2026-06-07T22:22:04.679057+00:00", "task": "credit-g", "model_family": "random_forest", "hyperparameters": {"n_estimators": 330, "max_features": "log2", "min_samples_leaf": 8}, "val_logloss": 0.513828, "val_acc": 0.73, "val_auc": 0.799881, "train_seconds": 0.276, "total_seconds": 0.426, "peak_mem_mb": 138.4, "n_params": 0, "status": "bo_trial", "description": "bo episode bo-ep001 trial 9", "source": "bo", "bo_episode_id": "bo-ep001", "bo_trial_index": 9, "estimator_class": null}
{"schema_version": 2, "trial_id": 16, "commit": "a3200cb", "timestamp": "2026-06-07T22:22:05.667427+00:00", "task": "credit-g", "model_family": "random_forest", "hyperparameters": {"n_estimators": 1479, "max_features": 0.5, "min_samples_leaf": 6}, "val_logloss": 1.221729, "val_acc": NaN, "val_auc": NaN, "train_seconds": NaN, "total_seconds": 0.981230700002925, "peak_mem_mb": NaN, "n_params": 0, "status": "bo_trial", "description": "bo episode bo-ep001 trial 10", "source": "bo", "bo_episode_id": "bo-ep001", "bo_trial_index": 10, "estimator_class": null}
{"schema_version": 2, "trial_id": 17, "commit": "5b70de4", "timestamp": "2026-06-07T22:23:16.088923+00:00", "task": "credit-g", "model_family": "xgboost", "hyperparameters": {"n_estimators": 1000, "early_stopping_rounds": 40, "eval_holdout_frac": 0.2, "max_depth": 3, "learning_rate": 0.03, "subsample": 0.8, "colsample_bytree": 0.8, "min_child_weight": 5, "reg_lambda": 2.0, "reg_alpha": 0.1}, "val_logloss": 0.499476, "val_acc": 0.755, "val_auc": 0.789643, "train_seconds": 0.2, "total_seconds": 0.3, "peak_mem_mb": 240.3, "n_params": 369, "status": "keep", "description": "", "source": "agent", "bo_episode_id": null, "bo_trial_index": null, "estimator_class": "XGBClassifier"}
{"schema_version": 2, "trial_id": 18, "commit": "8f22093", "timestamp": "2026-06-07T22:24:04.871188+00:00", "task": "credit-g", "model_family": "random_forest", "hyperparameters": {"n_estimators": 500, "max_depth": null, "min_samples_leaf": 1, "min_samples_split": 2, "max_features": "sqrt"}, "val_logloss": 0.470644, "val_acc": 0.76, "val_auc": 0.816786, "train_seconds": 0.3, "total_seconds": 0.5, "peak_mem_mb": 162.8, "n_params": 500, "status": "keep", "description": "", "source": "agent", "bo_episode_id": null, "bo_trial_index": null, "estimator_class": "ExtraTreesClassifier"}
{"schema_version": 2, "trial_id": 19, "commit": "aa26a01", "timestamp": "2026-06-07T22:24:38.761030+00:00", "task": "credit-g", "model_family": "unknown", "hyperparameters": {}, "val_logloss": NaN, "val_acc": NaN, "val_auc": NaN, "train_seconds": NaN, "total_seconds": NaN, "peak_mem_mb": NaN, "n_params": 0, "status": "crash", "description": "no summary block", "source": "agent", "bo_episode_id": null, "bo_trial_index": null, "estimator_class": "MLPClassifier"}
{"schema_version": 2, "trial_id": 20, "commit": "cc3e02a", "timestamp": "2026-06-07T22:24:55.044315+00:00", "task": "credit-g", "model_family": "unknown", "hyperparameters": {}, "val_logloss": NaN, "val_acc": NaN, "val_auc": NaN, "train_seconds": NaN, "total_seconds": NaN, "peak_mem_mb": NaN, "n_params": 0, "status": "crash", "description": "no summary block", "source": "agent", "bo_episode_id": null, "bo_trial_index": null, "estimator_class": "MLPClassifier"}
{"schema_version": 2, "trial_id": 21, "commit": "8760b85", "timestamp": "2026-06-07T22:25:31.092948+00:00", "task": "credit-g", "model_family": "mlp", "hyperparameters": {"hidden_layer_sizes": [128, 64], "activation": "relu", "alpha": 0.1, "learning_rate_init": 0.001, "max_iter": 500, "early_stopping": true, "validation_fraction": 0.15, "n_iter_no_change": 20}, "val_logloss": 0.515645, "val_acc": 0.735, "val_auc": 0.775833, "train_seconds": 0.1, "total_seconds": 0.2, "peak_mem_mb": 133.6, "n_params": 8192, "status": "keep", "description": "", "source": "agent", "bo_episode_id": null, "bo_trial_index": null, "estimator_class": "MLPClassifier"}
{"schema_version": 2, "trial_id": 22, "commit": "2271658", "timestamp": "2026-06-07T22:26:31.254748+00:00", "task": "credit-g", "model_family": "random_forest", "hyperparameters": {"n_estimators": 500, "max_depth": null, "min_samples_leaf": 1, "min_samples_split": 2, "max_features": "sqrt"}, "val_logloss": 0.504207, "val_acc": 0.745, "val_auc": 0.774286, "train_seconds": 0.3, "total_seconds": 0.5, "peak_mem_mb": 162.7, "n_params": 500, "status": "keep", "description": "", "source": "agent", "bo_episode_id": null, "bo_trial_index": null, "estimator_class": "ExtraTreesClassifier"}
{"schema_version": 2, "trial_id": 23, "commit": "b4cedbd", "timestamp": "2026-06-07T22:27:16.170495+00:00", "task": "credit-g", "model_family": "random_forest", "hyperparameters": {"n_estimators": 1000, "max_depth": null, "min_samples_leaf": 1, "min_samples_split": 2, "max_features": "sqrt"}, "val_logloss": 0.469061, "val_acc": 0.79, "val_auc": 0.821964, "train_seconds": 0.6, "total_seconds": 0.8, "peak_mem_mb": 187.4, "n_params": 1000, "status": "keep", "description": "", "source": "agent", "bo_episode_id": null, "bo_trial_index": null, "estimator_class": "ExtraTreesClassifier"}
{"schema_version": 2, "trial_id": 24, "commit": "c91ac2b", "timestamp": "2026-06-07T22:27:50.935528+00:00", "task": "credit-g", "model_family": "random_forest", "hyperparameters": {"n_estimators": 1000, "max_depth": null, "min_samples_leaf": 1, "min_samples_split": 2, "max_features": "sqrt"}, "val_logloss": 0.479323, "val_acc": 0.77, "val_auc": 0.809048, "train_seconds": 0.6, "total_seconds": 0.9, "peak_mem_mb": 184.1, "n_params": 1000, "status": "keep", "description": "", "source": "agent", "bo_episode_id": null, "bo_trial_index": null, "estimator_class": "ExtraTreesClassifier"}
{"schema_version": 2, "trial_id": 25, "commit": "6a4f0f9", "timestamp": "2026-06-07T22:28:20.558382+00:00", "task": "credit-g", "model_family": "random_forest", "hyperparameters": {"n_estimators": 2000, "max_depth": null, "min_samples_leaf": 1, "min_samples_split": 2, "max_features": "sqrt"}, "val_logloss": 0.469822, "val_acc": 0.76, "val_auc": 0.818452, "train_seconds": 1.2, "total_seconds": 1.6, "peak_mem_mb": 243.2, "n_params": 2000, "status": "keep", "description": "", "source": "agent", "bo_episode_id": null, "bo_trial_index": null, "estimator_class": "ExtraTreesClassifier"}
{"schema_version": 2, "trial_id": 26, "commit": "7fedb88", "timestamp": "2026-06-07T22:29:15.709874+00:00", "task": "credit-g", "model_family": "random_forest", "hyperparameters": {"n_estimators": 1000, "max_depth": null, "min_samples_leaf": 1, "min_samples_split": 2, "max_features": 0.3}, "val_logloss": 0.470538, "val_acc": 0.755, "val_auc": 0.815179, "train_seconds": 0.6, "total_seconds": 0.8, "peak_mem_mb": 180.5, "n_params": 1000, "status": "keep", "description": "", "source": "agent", "bo_episode_id": null, "bo_trial_index": null, "estimator_class": "ExtraTreesClassifier"}
{"schema_version": 2, "trial_id": 27, "commit": "d88b610", "timestamp": "2026-06-07T22:29:50.562022+00:00", "task": "credit-g", "model_family": "xgboost", "hyperparameters": {"n_estimators": 600, "max_depth": 4, "learning_rate": 0.03, "subsample": 0.8, "colsample_bytree": 0.8, "min_child_weight": 3, "reg_lambda": 2.0, "reg_alpha": 0.1}, "val_logloss": 0.535856, "val_acc": 0.735, "val_auc": 0.766071, "train_seconds": 0.2, "total_seconds": 0.3, "peak_mem_mb": 245.6, "n_params": 2400, "status": "keep", "description": "", "source": "agent", "bo_episode_id": null, "bo_trial_index": null, "estimator_class": "XGBClassifier"}
{"schema_version": 2, "trial_id": 28, "commit": "b0f052b", "timestamp": "2026-06-07T22:30:22.123184+00:00", "task": "credit-g", "model_family": "random_forest", "hyperparameters": {"n_estimators": 1000, "max_depth": null, "min_samples_leaf": 2, "min_samples_split": 2, "max_features": "sqrt"}, "val_logloss": 0.473661, "val_acc": 0.785, "val_auc": 0.820595, "train_seconds": 0.6, "total_seconds": 0.9, "peak_mem_mb": 169.6, "n_params": 1000, "status": "keep", "description": "", "source": "agent", "bo_episode_id": null, "bo_trial_index": null, "estimator_class": "ExtraTreesClassifier"}
{"schema_version": 2, "trial_id": 29, "commit": "da8729d", "timestamp": "2026-06-07T22:30:48.423596+00:00", "task": "credit-g", "model_family": "random_forest", "hyperparameters": {"n_estimators": 1000, "max_depth": null, "min_samples_leaf": 1, "min_samples_split": 2, "max_features": "sqrt"}, "val_logloss": 0.473158, "val_acc": 0.755, "val_auc": 0.814762, "train_seconds": 0.6, "total_seconds": 0.8, "peak_mem_mb": 188.6, "n_params": 1000, "status": "keep", "description": "", "source": "agent", "bo_episode_id": null, "bo_trial_index": null, "estimator_class": "ExtraTreesClassifier"}
{"schema_version": 2, "trial_id": 30, "commit": "8dba495", "timestamp": "2026-06-07T22:31:19.440406+00:00", "task": "credit-g", "model_family": "random_forest", "hyperparameters": {"n_estimators": 1000, "max_depth": null, "min_samples_leaf": 1, "min_samples_split": 2, "max_features": "sqrt"}, "val_logloss": 0.480519, "val_acc": 0.765, "val_auc": 0.815595, "train_seconds": 0.8, "total_seconds": 1.1, "peak_mem_mb": 170.0, "n_params": 1000, "status": "keep", "description": "", "source": "agent", "bo_episode_id": null, "bo_trial_index": null, "estimator_class": "ExtraTreesClassifier"}
{"schema_version": 2, "trial_id": 31, "commit": "420ae67", "timestamp": "2026-06-07T22:32:02.539474+00:00", "task": "credit-g", "model_family": "random_forest", "hyperparameters": {"n_estimators": 1000, "max_depth": null, "min_samples_leaf": 1, "min_samples_split": 2, "max_features": "sqrt"}, "val_logloss": 0.484358, "val_acc": 0.785, "val_auc": 0.805952, "train_seconds": 0.8, "total_seconds": 1.1, "peak_mem_mb": 159.4, "n_params": 1000, "status": "keep", "description": "", "source": "agent", "bo_episode_id": null, "bo_trial_index": null, "estimator_class": "RandomForestClassifier"}
{"schema_version": 2, "trial_id": 32, "commit": "5022b96", "timestamp": "2026-06-07T22:32:37.177740+00:00", "task": "credit-g", "model_family": "random_forest", "hyperparameters": {"n_estimators": 1000, "max_depth": null, "min_samples_leaf": 1, "min_samples_split": 2, "max_features": "sqrt"}, "val_logloss": 0.477718, "val_acc": 0.77, "val_auc": 0.809167, "train_seconds": 0.6, "total_seconds": 0.9, "peak_mem_mb": 187.9, "n_params": 1000, "status": "keep", "description": "", "source": "agent", "bo_episode_id": null, "bo_trial_index": null, "estimator_class": "ExtraTreesClassifier"}
{"schema_version": 2, "trial_id": 33, "commit": "d734794", "timestamp": "2026-06-07T22:33:18.891665+00:00", "task": "credit-g", "model_family": "random_forest", "hyperparameters": {"trees_per_forest": 200, "n_forests": 5, "max_depth": null, "min_samples_leaf": 1, "min_samples_split": 2, "max_features": "sqrt"}, "val_logloss": 0.474345, "val_acc": 0.76, "val_auc": 0.811429, "train_seconds": 0.7, "total_seconds": 1.1, "peak_mem_mb": 188.2, "n_params": 1000, "status": "keep", "description": "", "source": "agent", "bo_episode_id": null, "bo_trial_index": null, "estimator_class": "ExtraTreesClassifier"}
{"schema_version": 2, "trial_id": 34, "commit": "af396be", "timestamp": "2026-06-07T22:34:43.006784+00:00", "task": "credit-g", "model_family": "logistic_regression", "hyperparameters": {"c": 0.05, "max_iter": 3000}, "val_logloss": 0.515406, "val_acc": 0.74, "val_auc": 0.769405, "train_seconds": 0.0, "total_seconds": 0.1, "peak_mem_mb": 129.8, "n_params": 20, "status": "keep", "description": "", "source": "agent", "bo_episode_id": null, "bo_trial_index": null, "estimator_class": "LogisticRegression"}
{"schema_version": 2, "trial_id": 35, "commit": "2323fe3", "timestamp": "2026-06-07T22:35:29.398520+00:00", "task": "credit-g", "model_family": "random_forest", "hyperparameters": {"n_estimators": 1000, "max_depth": null, "min_samples_leaf": 1, "min_samples_split": 2, "max_features": "sqrt"}, "val_logloss": 0.469721, "val_acc": 0.77, "val_auc": 0.818512, "train_seconds": 0.6, "total_seconds": 0.8, "peak_mem_mb": 189.4, "n_params": 1000, "status": "keep", "description": "", "source": "agent", "bo_episode_id": null, "bo_trial_index": null, "estimator_class": "ExtraTreesClassifier"}
{"schema_version": 2, "trial_id": 36, "commit": "5afdff0", "timestamp": "2026-06-07T22:36:35.253858+00:00", "task": "credit-g", "model_family": "random_forest", "hyperparameters": {"n_estimators": 1000, "max_depth": null, "min_samples_leaf": 1, "min_samples_split": 2, "max_features": "sqrt"}, "val_logloss": 0.477138, "val_acc": 0.765, "val_auc": 0.809345, "train_seconds": 0.6, "total_seconds": 0.9, "peak_mem_mb": 186.8, "n_params": 1000, "status": "keep", "description": "", "source": "agent", "bo_episode_id": null, "bo_trial_index": null, "estimator_class": "ExtraTreesClassifier"}
{"schema_version": 2, "trial_id": 37, "commit": "d4d45bb", "timestamp": "2026-06-07T22:37:23.503066+00:00", "task": "credit-g", "model_family": "random_forest", "hyperparameters": {"n_estimators": 1000, "max_depth": null, "min_samples_leaf": 1, "min_samples_split": 2, "max_features": null}, "val_logloss": 0.477209, "val_acc": 0.76, "val_auc": 0.80125, "train_seconds": 0.6, "total_seconds": 0.9, "peak_mem_mb": 170.4, "n_params": 1000, "status": "keep", "description": "", "source": "agent", "bo_episode_id": null, "bo_trial_index": null, "estimator_class": "ExtraTreesClassifier"}
{"schema_version": 2, "trial_id": 38, "commit": "61ece78", "timestamp": "2026-06-07T22:38:00.001551+00:00", "task": "credit-g", "model_family": "random_forest", "hyperparameters": {"n_estimators": 1000, "max_depth": null, "min_samples_leaf": 1, "min_samples_split": 2, "max_features": "sqrt"}, "val_logloss": 0.475791, "val_acc": 0.765, "val_auc": 0.811726, "train_seconds": 0.6, "total_seconds": 0.9, "peak_mem_mb": 187.4, "n_params": 1000, "status": "keep", "description": "", "source": "agent", "bo_episode_id": null, "bo_trial_index": null, "estimator_class": "ExtraTreesClassifier"}
