{"schema_version": 2, "trial_id": 39, "commit": "58d6e87", "timestamp": "2026-06-07T22:39:04.884903+00:00", "task": "credit-g", "model_family": "random_forest", "hyperparameters": {"n_estimators": 1000, "max_depth": null, "min_samples_leaf": 1, "min_samples_split": 2, "max_features": "sqrt"}, "val_logloss": 0.485008, "val_acc": 0.785, "val_auc": 0.805536, "train_seconds": 0.6, "total_seconds": 0.8, "peak_mem_mb": 185.5, "n_params": 1000, "status": "keep", "description": "", "source": "agent", "bo_episode_id": null, "bo_trial_index": null, "estimator_class": "ExtraTreesClassifier"}
{"schema_version": 2, "trial_id": 40, "commit": "2da2612", "timestamp": "2026-06-07T22:41:44.419107+00:00", "task": "credit-g", "model_family": "unknown", "hyperparameters": {}, "val_logloss": NaN, "val_acc": NaN, "val_auc": NaN, "train_seconds": NaN, "total_seconds": NaN, "peak_mem_mb": NaN, "n_params": 0, "status": "crash", "description": "no summary block", "source": "agent", "bo_episode_id": null, "bo_trial_index": null, "estimator_class": "StackingClassifier"}
{"schema_version": 2, "trial_id": 41, "commit": "0d232e8", "timestamp": "2026-06-07T22:42:32.959266+00:00", "task": "credit-g", "model_family": "random_forest", "hyperparameters": {"n_estimators": 500, "max_depth": null, "min_samples_leaf": 1, "max_features": "sqrt", "meta_c": 0.1}, "val_logloss": 0.492674, "val_acc": 0.75, "val_auc": 0.787024, "train_seconds": 2.4, "total_seconds": 2.6, "peak_mem_mb": 184.8, "n_params": 2500, "status": "keep", "description": "", "source": "agent", "bo_episode_id": null, "bo_trial_index": null, "estimator_class": "LogisticRegression"}
{"schema_version": 2, "trial_id": 42, "commit": "bc08da7", "timestamp": "2026-06-07T22:45:00.216328+00:00", "task": "credit-g", "model_family": "random_forest", "hyperparameters": {"n_estimators": 1000, "max_depth": null, "min_samples_leaf": 2, "min_samples_split": 2, "max_features": "sqrt"}, "val_logloss": 0.473661, "val_acc": 0.785, "val_auc": 0.820595, "train_seconds": 0.6, "total_seconds": 0.9, "peak_mem_mb": 169.2, "n_params": 1000, "status": "keep", "description": "", "source": "agent", "bo_episode_id": null, "bo_trial_index": null, "estimator_class": "ExtraTreesClassifier"}
{"schema_version": 2, "trial_id": 43, "commit": "6f026e7", "timestamp": "2026-06-07T22:45:42.191979+00:00", "task": "credit-g", "model_family": "random_forest", "hyperparameters": {"n_estimators": 1000, "max_depth": null, "min_samples_leaf": 1, "min_samples_split": 2, "max_features": "sqrt"}, "val_logloss": 0.480519, "val_acc": 0.765, "val_auc": 0.815595, "train_seconds": 0.8, "total_seconds": 1.1, "peak_mem_mb": 169.3, "n_params": 1000, "status": "keep", "description": "", "source": "agent", "bo_episode_id": null, "bo_trial_index": null, "estimator_class": "ExtraTreesClassifier"}
{"schema_version": 2, "trial_id": 44, "commit": "ca98b8b", "timestamp": "2026-06-07T22:46:06.630139+00:00", "task": "credit-g", "model_family": "random_forest", "hyperparameters": {"n_estimators": 1000, "max_depth": null, "min_samples_leaf": 1, "min_samples_split": 2, "max_features": "sqrt"}, "val_logloss": 0.47343, "val_acc": 0.755, "val_auc": 0.811786, "train_seconds": 0.6, "total_seconds": 0.9, "peak_mem_mb": 183.2, "n_params": 1000, "status": "keep", "description": "", "source": "agent", "bo_episode_id": null, "bo_trial_index": null, "estimator_class": "ExtraTreesClassifier"}
{"schema_version": 2, "trial_id": 45, "commit": "feb15d1", "timestamp": "2026-06-07T22:46:55.634515+00:00", "task": "credit-g", "model_family": "random_forest", "hyperparameters": {"n_estimators": 1000, "max_depth": null, "min_samples_leaf": 1, "min_samples_split": 2, "max_features": 0.5}, "val_logloss": 0.472941, "val_acc": 0.76, "val_auc": 0.805595, "train_seconds": 0.6, "total_seconds": 0.8, "peak_mem_mb": 173.4, "n_params": 1000, "status": "keep", "description": "", "source": "agent", "bo_episode_id": null, "bo_trial_index": null, "estimator_class": "ExtraTreesClassifier"}
{"schema_version": 2, "trial_id": 46, "commit": "60bf703", "timestamp": "2026-06-07T22:47:53.597382+00:00", "task": "credit-g", "model_family": "random_forest", "hyperparameters": {"n_per_estimator": 300, "max_depth": null, "min_samples_leaf": 1, "min_samples_split": 2, "max_features": "sqrt"}, "val_logloss": 0.470461, "val_acc": 0.77, "val_auc": 0.82006, "train_seconds": 0.6, "total_seconds": 0.9, "peak_mem_mb": 182.2, "n_params": 900, "status": "keep", "description": "", "source": "agent", "bo_episode_id": null, "bo_trial_index": null, "estimator_class": "ExtraTreesClassifier"}
{"schema_version": 2, "trial_id": 47, "commit": "92771c0", "timestamp": "2026-06-07T22:48:53.579523+00:00", "task": "credit-g", "model_family": "xgboost", "hyperparameters": {"max_iter": 500, "learning_rate": 0.05, "max_leaf_nodes": 31, "min_samples_leaf": 20, "l2_regularization": 0.5}, "val_logloss": 0.750356, "val_acc": 0.735, "val_auc": 0.751905, "train_seconds": 2.2, "total_seconds": 2.3, "peak_mem_mb": 135.8, "n_params": 500, "status": "keep", "description": "", "source": "agent", "bo_episode_id": null, "bo_trial_index": null, "estimator_class": "HistGradientBoostingClassifier"}
{"schema_version": 2, "trial_id": 48, "commit": "f9f0921", "timestamp": "2026-06-07T22:49:43.269583+00:00", "task": "credit-g", "model_family": "xgboost", "hyperparameters": {"max_iter": 200, "learning_rate": 0.05, "max_leaf_nodes": 15, "min_samples_leaf": 10, "l2_regularization": 1.0}, "val_logloss": 0.52015, "val_acc": 0.76, "val_auc": 0.7825, "train_seconds": 1.6, "total_seconds": 1.7, "peak_mem_mb": 134.6, "n_params": 200, "status": "keep", "description": "", "source": "agent", "bo_episode_id": null, "bo_trial_index": null, "estimator_class": "HistGradientBoostingClassifier"}
{"schema_version": 2, "trial_id": 49, "commit": "21e8cb5", "timestamp": "2026-06-07T22:50:09.779323+00:00", "task": "credit-g", "model_family": "random_forest", "hyperparameters": {"n_estimators": 1500, "max_depth": null, "min_samples_leaf": 1, "min_samples_split": 2, "max_features": "sqrt"}, "val_logloss": 0.470093, "val_acc": 0.765, "val_auc": 0.819107, "train_seconds": 0.9, "total_seconds": 1.2, "peak_mem_mb": 216.2, "n_params": 1500, "status": "keep", "description": "", "source": "agent", "bo_episode_id": null, "bo_trial_index": null, "estimator_class": "ExtraTreesClassifier"}
{"schema_version": 2, "trial_id": 50, "commit": "62f34c3", "timestamp": "2026-06-07T22:50:57.777187+00:00", "task": "credit-g", "model_family": "random_forest", "hyperparameters": {"n_estimators": 1000, "max_depth": null, "min_samples_leaf": 1, "min_samples_split": 2, "max_features": "sqrt"}, "val_logloss": 0.477718, "val_acc": 0.77, "val_auc": 0.809167, "train_seconds": 0.6, "total_seconds": 0.9, "peak_mem_mb": 188.6, "n_params": 1000, "status": "keep", "description": "", "source": "agent", "bo_episode_id": null, "bo_trial_index": null, "estimator_class": "ExtraTreesClassifier"}
